{
  "task_id": "CORE-009",
  "git_commit": "69d23c386c5e429db6ed4a710a715cd4192b333b",
  "recorded_at": "2026-09-12T02:56:32Z",
  "commands": [
    {
      "command": "QUANSIO_TEST_POSTGRES_URL=postgres://quansio:quansio-dev-only@127.0.0.1:55440/quansio cargo test -p quansio-events",
      "exit_code": 0,
      "result": "PASS",
      "log": "evidence/CORE-009/2026-09-12T02-55-07Z/command-1.log"
    },
    {
      "command": "QUANSIO_TEST_POSTGRES_URL=postgres://quansio:quansio-dev-only@127.0.0.1:55440/quansio cargo test --workspace",
      "exit_code": 0,
      "result": "PASS",
      "log": "evidence/CORE-009/2026-09-12T02-55-07Z/command-2.log"
    },
    {
      "command": "cargo fmt --all --check",
      "exit_code": 0,
      "result": "PASS",
      "log": "evidence/CORE-009/2026-09-12T02-55-07Z/command-3.log"
    },
    {
      "command": "cargo clippy --workspace --all-targets -- -D warnings",
      "exit_code": 0,
      "result": "PASS",
      "log": "evidence/CORE-009/2026-09-12T02-55-07Z/command-4.log"
    },
    {
      "command": "bash scripts/ci/ci.sh",
      "exit_code": 1,
      "result": "FAIL",
      "log": "evidence/CORE-009/2026-09-12T02-55-07Z/command-5.log"
    },
    {
      "command": "python3.12 scripts/validate_v81.py",
      "exit_code": 0,
      "result": "PASS",
      "log": "evidence/CORE-009/2026-09-12T02-55-07Z/command-6.log"
    }
  ],
  "results": [
    {
      "command": "QUANSIO_TEST_POSTGRES_URL=postgres://quansio:quansio-dev-only@127.0.0.1:55440/quansio cargo test -p quansio-events",
      "exit_code": 0,
      "result": "PASS"
    },
    {
      "command": "QUANSIO_TEST_POSTGRES_URL=postgres://quansio:quansio-dev-only@127.0.0.1:55440/quansio cargo test --workspace",
      "exit_code": 0,
      "result": "PASS"
    },
    {
      "command": "cargo fmt --all --check",
      "exit_code": 0,
      "result": "PASS"
    },
    {
      "command": "cargo clippy --workspace --all-targets -- -D warnings",
      "exit_code": 0,
      "result": "PASS"
    },
    {
      "command": "bash scripts/ci/ci.sh",
      "exit_code": 1,
      "result": "FAIL"
    },
    {
      "command": "python3.12 scripts/validate_v81.py",
      "exit_code": 0,
      "result": "PASS"
    }
  ],
  "artifacts": [
    {
      "path": "crates/events/src/projection.rs",
      "sha256": "9d6fb35904b7e8ac39898b715fef6a12eb7f4653cf48a93ea5009177f9a512f7",
      "bytes": 23303
    },
    {
      "path": "crates/events/src/stream.rs",
      "sha256": "96c794104b6291820158d91a063dd3a78c60231826e199f541d3f87e9b0ddf43",
      "bytes": 23719
    },
    {
      "path": "crates/events/tests/projection_determinism.rs",
      "sha256": "72de69c0b1421682f104c9fa552858ec102d9c9593e0e1e696c4cc97d3e9707b",
      "bytes": 9896
    },
    {
      "path": "crates/events/tests/stream_backpressure.rs",
      "sha256": "7c735c45aa8d6ec08f9cea6232ea4a9fa992b67d6a23388ccae53f6ab0f46f39",
      "bytes": 4115
    },
    {
      "path": "crates/events/tests/stream_resume.rs",
      "sha256": "531df5d17b74c6aab58796d1800001c61a32267322f0ab1b813f9daea83c2519",
      "bytes": 6993
    },
    {
      "path": "migrations/0005_projections.sql",
      "sha256": "739246511d107afa2bbc85b6a0da2deb6caccf5885c17f58f29d32ff54421e30",
      "bytes": 4220
    }
  ]
}
