{
  "task_id": "QA-008",
  "git_commit": "4b6b5530b153a6096bafa3385eb965461554a606",
  "recorded_at": "2026-09-26T16:29:33Z",
  "commands": [
    {
      "command": "QUANSIO_TEST_POSTGRES_URL=<dev .env DSN> QUANSIO_TEST_SERVER_BIN/SEED_BIN=<pinned builds of main> pnpm test:e2e --no-file-parallelism # real Electron 44.4.3 and Chrome 153 against quansio-server: 12 desktop journeys on the chat-first shell, 7 web journeys, 4 module journeys",
      "exit_code": 0,
      "result": "PASS",
      "log": "evidence/QA-008/2026-09-26T16-29-22Z/e2e.log"
    },
    {
      "command": "bash qa008_mutations.sh # 7 UI mutants, each after a passing control on a fresh build of the unmutated tree; all must be killed",
      "exit_code": 0,
      "result": "PASS",
      "log": "evidence/QA-008/2026-09-26T16-29-22Z/mutations.log"
    },
    {
      "command": "bash scripts/ci/ci.sh --out ci-summary.json # 11 gates",
      "exit_code": 0,
      "result": "PASS",
      "log": "evidence/QA-008/2026-09-26T16-29-22Z/ci.log"
    }
  ],
  "results": [
    {
      "command": "QUANSIO_TEST_POSTGRES_URL=<dev .env DSN> QUANSIO_TEST_SERVER_BIN/SEED_BIN=<pinned builds of main> pnpm test:e2e --no-file-parallelism # real Electron 44.4.3 and Chrome 153 against quansio-server: 12 desktop journeys on the chat-first shell, 7 web journeys, 4 module journeys",
      "exit_code": 0,
      "result": "PASS"
    },
    {
      "command": "bash qa008_mutations.sh # 7 UI mutants, each after a passing control on a fresh build of the unmutated tree; all must be killed",
      "exit_code": 0,
      "result": "PASS"
    },
    {
      "command": "bash scripts/ci/ci.sh --out ci-summary.json # 11 gates",
      "exit_code": 0,
      "result": "PASS"
    }
  ],
  "artifacts": [
    {
      "path": "evidence/QA-008/2026-09-26T16-29-22Z/NOTES.md",
      "sha256": "6e3f7ac631044ce4bc4b6b2b1e4c78fcdd0ab371566320a69f9a21f118803793",
      "bytes": 6592
    },
    {
      "path": "evidence/QA-008/2026-09-26T16-29-22Z/ci-summary.json",
      "sha256": "89b3b411031dad8d250f406ba5d4aaea166c0d0ef4147dd93eebb8d98d0338c7",
      "bytes": 8036
    },
    {
      "path": "evidence/QA-008/2026-09-26T16-29-22Z/ci.log",
      "sha256": "38a2c692cad9199a6eacb21fdd4d169ee5a8acc1eb4e73efc58239a1c792c1e0",
      "bytes": 1108
    },
    {
      "path": "evidence/QA-008/2026-09-26T16-29-22Z/e2e.log",
      "sha256": "b8a3b4543856dc1247e9d82135271ced3958921ec6750e1dc7464ce7308a512f",
      "bytes": 5610
    },
    {
      "path": "evidence/QA-008/2026-09-26T16-29-22Z/mutations.log",
      "sha256": "9d214b3b8f861434e695c446c21c73470b64d4b17b72936d25f5bd11586eb683",
      "bytes": 775
    }
  ]
}
