{
  "task_id": "APP-003",
  "git_commit": "25ff287c09ba60a6ca2f8b467b3e482634986d34",
  "recorded_at": "2026-09-26T19:33:08Z",
  "commands": [
    {
      "command": "QUANSIO_TEST_POSTGRES_URL=<dev .env DSN> vitest run # desktop-suite",
      "exit_code": 0,
      "result": "PASS",
      "log": "evidence/APP-003/2026-09-26T19-33-08Z/desktop-suite.log"
    }
  ],
  "results": [
    {
      "command": "QUANSIO_TEST_POSTGRES_URL=<dev .env DSN> vitest run # desktop-suite",
      "exit_code": 0,
      "result": "PASS"
    }
  ],
  "artifacts": [
    {
      "path": "evidence/APP-003/2026-09-26T19-33-08Z/NOTES.md",
      "sha256": "981a5052950ca5c978dfb47da29158ed585cad367dc0e50dc36a99ec10808048",
      "bytes": 922
    },
    {
      "path": "evidence/APP-003/2026-09-26T19-33-08Z/desktop-suite.log",
      "sha256": "3f4c0f00fc43e02a7d2937aedb356f51bd59a506921d380c8c37f2f8e33b8972",
      "bytes": 5575
    }
  ]
}
